{
  "$schema": "../schemas/population_class.schema.json",
  "id": "peasant",
  "name": "Peasant",
  "consumption_per_head_per_tick": {
    "wheat_bushel": 0.015
  },
  "coin_income_per_head_per_tick": 0.01,
  "labor_days_per_head_per_tick": 0.8,
  "luxury_demand_fraction": 0.0,
  "unrest_per_food_shortage": 0.002,
  "min_tier": 0,
  "tags": ["food_producer", "farmer", "laborer"]
}
